{
  "$schema": "../schema.json",
  "slug": "multisite-block-theme-sync",
  "name": "Multisite Block Theme Sync",
  "type": "plugin",
  "repo": "WPMultisite/multisite-block-theme-sync",
  "main_file": "multisite-block-theme-sync.php",
  "description": "Advanced theme management and synchronization across WordPress multisite network with Block Theme compatibility and bulk switching capabilities.",
  "homepage": "https://wpcy.com/multisite-block-theme-sync",
  "author": "WPMultisite.com",
  "author_uri": "https://wpcy.com/multisite-block-theme-sync",
  "license": "GPL-2.0-or-later",
  "requires_wp": "6.0",
  "requires_php": "7.4",
  "tested_wp": "6.8",
  "tags": [
    "multisite",
    "sync",
    "theme",
    "block-editor"
  ],
  "active": true
}
