{
  "$schema": "../schema.json",
  "slug": "wpban",
  "name": "文派板砖",
  "type": "plugin",
  "repo": "WenPai-org/wpban",
  "main_file": "wpban.php",
  "description": "自动禁止恶意 IP 和引荐来源",
  "homepage": "https://wpcy.com/wpban",
  "author": "WenPai",
  "author_uri": "https://wpcy.com/wpban",
  "license": "GPL-2.0-or-later",
  "requires_wp": "6.0",
  "requires_php": "7.4",
  "tested_wp": "6.7.1",
  "tags": [
    "security",
    "ban"
  ],
  "icons": {
    "1x": "https://updates.wenpai.net/assets/wpban/icon-128x128.png",
    "2x": "https://updates.wenpai.net/assets/wpban/icon-256x256.png",
    "svg": "https://updates.wenpai.net/assets/wpban/icon-256x256.svg"
  },
  "banners": {
    "low": "https://updates.wenpai.net/assets/wpban/banner-772x250.png",
    "high": "https://updates.wenpai.net/assets/wpban/banner-1544x500.png"
  },
  "active": true
}
