{
  "$schema": "../schema.json",
  "slug": "wpmailer",
  "name": "文派邮局",
  "type": "plugin",
  "repo": "WenPai-org/wpmailer",
  "main_file": "wpmailer.php",
  "description": "WordPress 批量发送通知、新闻、促销邮件",
  "homepage": "https://wpcy.com/wpmailer",
  "author": "WenPai",
  "author_uri": "https://wpcy.com/wpmailer",
  "license": "GPL-2.0-or-later",
  "requires_wp": "6.0",
  "requires_php": "7.4",
  "tested_wp": "6.7.1",
  "tags": [
    "email",
    "smtp"
  ],
  "icons": {
    "1x": "https://updates.wenpai.net/assets/wpmailer/icon-128x128.png",
    "2x": "https://updates.wenpai.net/assets/wpmailer/icon-256x256.png",
    "svg": "https://updates.wenpai.net/assets/wpmailer/icon-256x256.svg"
  },
  "banners": {
    "low": "https://updates.wenpai.net/assets/wpmailer/banner-772x250.png",
    "high": "https://updates.wenpai.net/assets/wpmailer/banner-1544x500.png"
  },
  "active": true
}
