{
  "$schema": "../schema.json",
  "slug": "wpicp",
  "name": "文派备案",
  "type": "plugin",
  "repo": "WenPai-org/wpicp",
  "main_file": "wpicp.php",
  "description": "ICP 备案和公安备案实名认证",
  "homepage": "https://wpcy.com/wpicp",
  "author": "WenPai",
  "author_uri": "https://wpcy.com/wpicp",
  "license": "GPL-2.0-or-later",
  "requires_wp": "6.0",
  "requires_php": "7.4",
  "tested_wp": "6.7.1",
  "tags": [
    "icp",
    "compliance"
  ],
  "icons": {
    "1x": "https://updates.wenpai.net/assets/wpicp/icon-128x128.png",
    "2x": "https://updates.wenpai.net/assets/wpicp/icon-256x256.png",
    "svg": "https://updates.wenpai.net/assets/wpicp/icon-256x256.svg"
  },
  "banners": {
    "low": "https://updates.wenpai.net/assets/wpicp/banner-772x250.png",
    "high": "https://updates.wenpai.net/assets/wpicp/banner-1544x500.png"
  },
  "active": true
}
