{
  "$schema": "../schema.json",
  "slug": "wp-domain-mapping",
  "name": "文派域名映射",
  "type": "plugin",
  "repo": "WenPai-org/wp-domain-mapping",
  "main_file": "wp-domain-mapping.php",
  "description": "WordPress 多站点子站绑定域名",
  "author": "WenPai",
  "license": "GPL-2.0-or-later",
  "requires_wp": "6.0",
  "requires_php": "7.4",
  "tested_wp": "6.7.1",
  "tags": [
    "multisite",
    "domain"
  ],
  "icons": {
    "1x": "https://updates.wenpai.net/assets/wp-domain-mapping/icon-128x128.png",
    "2x": "https://updates.wenpai.net/assets/wp-domain-mapping/icon-256x256.png",
    "svg": "https://updates.wenpai.net/assets/wp-domain-mapping/icon-256x256.svg"
  },
  "banners": {
    "low": "https://updates.wenpai.net/assets/wp-domain-mapping/banner-772x250.png",
    "high": "https://updates.wenpai.net/assets/wp-domain-mapping/banner-1544x500.png"
  },
  "active": true,
  "homepage": "https://wpcy.com/wp-domain-mapping",
  "author_uri": "https://wpcy.com/wp-domain-mapping"
}
