{
  "$schema": "../schema.json",
  "slug": "wpavatar",
  "name": "文派头像",
  "type": "plugin",
  "repo": "WenPai-org/wpavatar",
  "main_file": "wpavatar.php",
  "description": "面向中国互联网用户的开放式网络头像服务",
  "homepage": "https://wpcy.com/wpavatar",
  "author": "WenPai",
  "author_uri": "https://wpcy.com/wpavatar",
  "license": "GPL-2.0-or-later",
  "requires_wp": "5.9",
  "requires_php": "7.4",
  "tested_wp": "6.7.1",
  "tags": [
    "avatar",
    "cravatar"
  ],
  "icons": {
    "1x": "https://updates.wenpai.net/assets/wpavatar/icon-128x128.png",
    "2x": "https://updates.wenpai.net/assets/wpavatar/icon-256x256.png",
    "svg": "https://updates.wenpai.net/assets/wpavatar/icon-256x256.svg"
  },
  "banners": {
    "low": "https://updates.wenpai.net/assets/wpavatar/banner-772x250.png",
    "high": "https://updates.wenpai.net/assets/wpavatar/banner-1544x500.png"
  },
  "active": true
}
