{
  "$schema": "../schema.json",
  "slug": "wpmind",
  "name": "文派心思",
  "type": "plugin",
  "repo": "WenPai-org/wpmind",
  "main_file": "wpmind.php",
  "description": "基于 AI 的页面构建器",
  "homepage": "https://wpcy.com/mind",
  "author": "WenPai",
  "author_uri": "https://wpcy.com/mind",
  "license": "GPL-2.0-or-later",
  "requires_wp": "6.0",
  "requires_php": "8.1",
  "tested_wp": "6.7.1",
  "tags": [
    "ai",
    "content"
  ],
  "icons": {
    "1x": "https://updates.wenpai.net/assets/wpmind/icon-128x128.png",
    "2x": "https://updates.wenpai.net/assets/wpmind/icon-256x256.png",
    "svg": "https://updates.wenpai.net/assets/wpmind/icon-256x256.svg"
  },
  "banners": {
    "low": "https://updates.wenpai.net/assets/wpmind/banner-772x250.png",
    "high": "https://updates.wenpai.net/assets/wpmind/banner-1544x500.png"
  },
  "active": true
}
