{
    "$schema": "../schema.json",
    "slug": "wpslug",
    "name": "文派素格",
    "type": "plugin",
    "repo": "WenPai-org/wpslug",
    "main_file": "wpslug.php",
    "description": "Generate readable slugs with local Chinese pinyin, transliteration, optional translation providers, and safe media filenames.",
    "author": "WPCY.COM",
    "license": "GPL-2.0-or-later",
    "requires_wp": "6.0",
    "requires_php": "7.4",
    "tested_wp": "7.2",
    "tags": [
        "slug",
        "pinyin",
        "transliteration",
        "translation",
        "media"
    ],
    "icons": {
        "1x": "https://updates.wenpai.net/assets/wpslug/icon-128x128.png",
        "2x": "https://updates.wenpai.net/assets/wpslug/icon-256x256.png",
        "svg": "https://updates.wenpai.net/assets/wpslug/icon-256x256.svg"
    },
    "banners": {
        "low": "https://updates.wenpai.net/assets/wpslug/banner-772x250.png",
        "high": "https://updates.wenpai.net/assets/wpslug/banner-1544x500.png"
    },
    "active": true,
    "homepage": "https://wpcy.com/slug",
    "author_uri": "https://wpcy.com/slug"
}
